{
  "molssi_bse_schema": {
    "schema_type": "metadata",
    "schema_version": "0.1"
  },
  "names": [
    "jorge-DZP-ZORA"
  ],
  "tags": [],
  "family": "jorge",
  "description": "DZP-ZORA: All-electron double zeta valence quality plus polarization functions (ZORA)",
  "role": "orbital",
  "auxiliaries": {}
}